{"$schema":"https://json-schema.org/draft/2020-12/schema","type":"object","additionalProperties":false,"required":["schemaVersion","specId","revision","status","canonicalContentHash","productContentHash","generatedAt","hostIdentifier","requestedBy","instructions","validationFailures","handoffEligible"],"properties":{"schemaVersion":{"const":"1.0.0"},"specId":{"$ref":"#/$defs/id"},"revision":{"type":"integer","minimum":1},"status":{"enum":["Draft","Blocked by product decision","Ready for design review","Ready for technical planning","Ready for implementation","Returned for product revision"]},"canonicalContentHash":{"$ref":"#/$defs/hash"},"productContentHash":{"$ref":"#/$defs/hash"},"generatedAt":{"type":"string","format":"date-time"},"hostIdentifier":{"$ref":"#/$defs/id"},"requestedBy":{"$ref":"#/$defs/id"},"instructions":{"type":"string","maxLength":20000},"validationFailures":{"type":"array","maxItems":1000,"items":{"$ref":"senior-pm-spec.schema.json#/$defs/failure"}},"handoffEligible":{"type":"boolean"}},"$defs":{"id":{"type":"string","minLength":1,"maxLength":200,"pattern":"^[^/\\\\]+$"},"hash":{"type":"string","pattern":"^[a-f0-9]{64}$"}}}
